<!ELEMENT customers (customer*)>
<!ELEMENT customer EMPTY>

<!ATTLIST customers minID NMTOKEN #REQUIRED>
<!ATTLIST customer 	cID NMTOKEN #REQUIRED
					firtName CDATA #REQUIRED
					lastName CDATA #REQUIRED
					birthDate NMTOKEN #REQUIRED
					street CDATA #REQUIRED						
					houseNr NMTOKEN #REQUIRED
					zipCode NMTOKEN #REQUIRED
					city CDATA #REQUIRED
					identificationNr NMTOKEN #REQUIRED
					title (Herr|Frau) #REQUIRED>